ID,Title,Problem Statement,Domain,Suggested Technologies,Topic
1,Smart Elderly Health Tracker,"Many elderly in Little India suffer from chronic illnesses like diabetes and hypertension. A mobile app integrated with wearables can monitor vitals and alert caregivers in real time, ensuring timely medical intervention.",Health,"Mobile app, IoT, AI",Supports elderly healthcare in culturally familiar environments.
2,Traditional Sports Digital League,"Kabaddi and gilli-danda are losing popularity among youth. A web platform could manage tournaments, keep scores digitally, and provide AI-based skill analytics to revive interest in traditional games.",Sports,"Web app, AI analytics",Preserves and promotes traditional Indian sports.
3,Urban Rooftop Farming Assistant,"Urban residents in Little India often grow vegetables on rooftops. An AI-powered assistant can provide real-time guidance on crop care, pest control, and organic farming techniques based on user inputs.",Agriculture,"Mobile app, AI",Encourages sustainable urban agriculture.
4,AI-Powered Yoga Posture Guide,"Beginners in yoga risk injury from incorrect postures. A mobile app using computer vision can guide users to adjust their poses in real-time, ensuring safe and effective practice.",Yoga,"Mobile app, AI (pose estimation)",Encourages safe yoga practice.
5,Diabetic-Friendly Recipe Recommender,"Many residents struggle to balance traditional Indian food with diabetic diets. A recipe recommendation engine using AI could suggest culturally familiar, low-sugar alternatives.",Health,"Web app, AI recommendation",Supports diabetic health management.
6,AI Soil Health Tester,Farmers in peri-urban Little India areas often lack access to soil labs. An app allowing users to upload soil images for AI-based nutrient and pH analysis can improve farming outcomes.,Agriculture,"Mobile app, AI image analysis",Improves small-scale agriculture productivity.
7,Virtual Yoga Community Platform,"Yoga practitioners often lose motivation when practicing alone. A platform for live-streamed yoga sessions, peer interaction, and AI-based progress tracking could boost engagement.",Yoga,"Web app, AI analytics",Strengthens yoga practice within community.
8,Cricket Injury Prevention Tool,Young cricketers risk overuse injuries. A motion capture web app could detect risky bowling or batting postures and suggest corrections to reduce injury rates.,Sports,"Web app, AI motion analysis",Supports safe sports training.
9,Elderly Companion Chatbot,"Loneliness among elders is a growing problem. A culturally tuned chatbot can provide companionship, reminders for medication, and connect users with family or volunteers.",Health,"Mobile app, AI chatbot",Reduces elderly loneliness.
10,AI Crop Disease Detector,Urban and peri-urban farmers lose crops to undetected diseases. A mobile app allowing photo uploads for AI-based diagnosis and treatment tips can prevent losses.,Agriculture,"Mobile app, AI image recognition",Protects crops vital to local diets.
11,Mental Wellness Tracker for Yoga Practitioners,Many yoga practitioners track poses but not mental well-being. An app combining meditation logs with sentiment analysis from journal entries can monitor holistic wellness.,Yoga,"Mobile app, AI NLP",Encourages balanced wellness.
12,Festival Air Quality Monitor,"During major festivals in Little India, air quality can drop due to firecrackers and crowding. A web dashboard displaying real-time AQI data and safety tips can promote public health.",Health,"Web app, IoT sensors",Improves festival health safety.
13,Kabaddi Skills Analyzer,"Kabaddi players often lack formal coaching. A video analysis tool using AI can break down techniques and suggest improvements, making coaching accessible to all.",Sports,"Web app, AI video analytics",Improves traditional sports performance.
14,Herbal Remedy Knowledge Base,Younger generations may lose knowledge of traditional herbal remedies. A community-driven app with AI search can connect symptoms to culturally relevant remedies.,Health,"Mobile app, AI search",Preserves traditional knowledge.
15,IoT-based Irrigation Optimizer,Urban gardeners often overwater or underwater plants. A smart irrigation system using IoT sensors and AI weather predictions can optimize water use.,Agriculture,"IoT, AI",Promotes sustainable agriculture.
16,Meditation Distraction Reducer,Practicing yoga and meditation in noisy city areas is hard. A web app using AI noise classification could suggest the best time or place for quiet sessions.,Yoga,"Web app, AI audio analysis",Improves meditation quality.
17,Smart Cricket Scoreboard,"Street cricket in Little India often lacks proper scoring. A mobile app with AI object detection can track runs, wickets, and ball speed in real-time from phone cameras.",Sports,"Mobile app, AI vision",Makes casual cricket more engaging.
18,Elderly Emergency Alert Wearable,Elderly residents living alone may fall or face health emergencies. A wearable with fall detection and instant alert to caregivers can save lives.,Health,"IoT wearable, AI",Protects vulnerable elders.
19,AI Nutrient Intake Tracker,Residents eating outside often can’t track nutrients. An AI-powered mobile app can estimate nutrition from meal photos and track health goals.,Health,"Mobile app, AI image recognition",Encourages healthy eating.
20,Yoga Progress Visualizer,"Yoga learners often can't see their improvement. A web app using pose tracking over weeks can create visual progress timelines, boosting motivation.",Yoga,"Web app, AI pose estimation",Encourages consistent practice.
21,Organic Fertilizer Marketplace,"Urban farmers lack easy access to organic fertilizers. A platform connecting suppliers with buyers, using AI for demand prediction, can strengthen farming.",Agriculture,"Web app, AI forecasting",Supports sustainable agriculture.
22,Cricket Talent Finder,Hidden cricket talent in Little India often goes unnoticed. A web platform could analyze amateur match videos to spot promising players.,Sports,"Web app, AI video analytics",Encourages sports development.
23,Cultural Food Allergen Detector,Tourists and locals with allergies struggle to identify allergens in Indian food. A mobile app using AI food recognition could flag allergens instantly.,Health,"Mobile app, AI image classification",Improves food safety.
24,AI Water Quality Checker,Residents relying on local water sources may face contamination risks. An AI-powered system analyzing sensor data can give early warnings.,Health,"IoT sensors, AI",Ensures safe water consumption.
25,Farm Produce Price Predictor,"Small-scale farmers face fluctuating prices. An AI model could predict future prices based on demand trends, helping them sell at the right time.",Agriculture,"Web app, AI forecasting",Improves farmer income.
26,Guided Breathing Exercise Web App,Stress relief through breathing exercises is common in yoga. A web app could guide sessions using AI to track breath patterns via microphone input.,Yoga,"Web app, AI audio analysis",Encourages stress management.
27,Fitness Challenge Tracker for Traditional Games,"Games like kho-kho and kabaddi could have community challenges tracked via a mobile app with AI scoring, reviving interest.",Sports,"Mobile app, AI motion tracking",Promotes active lifestyle.
28,Health Check-up Scheduler,Elderly often forget medical appointments. A culturally familiar app with AI reminders can ensure they never miss a check-up.,Health,"Mobile app, AI scheduling",Improves elderly healthcare.
29,Virtual Farming Advisor,"Urban farmers need quick advice. A chatbot using AI could answer questions about pests, soil, and weather in real-time.",Agriculture,"Web app, AI chatbot",Supports small farmers.
30,Yoga Event Finder,Finding local yoga sessions can be hard. A web app using AI to recommend events based on health goals can boost participation.,Yoga,"Web app, AI recommendation",Promotes wellness participation.
32,Diabetes Meal Image Analyzer,"Many Indian elders and middle-aged residents in Little India struggle to monitor sugar intake while eating traditional meals like dosa, biryani, or sweets. A web app could let users upload a photo of their plate, use ML-based food recognition to detect the dishes, estimate calories & sugar content, and suggest healthier alternatives.",Health,"Web app, ML (image classification)",Promotes culturally familiar but healthier eating habits.
33,Little India Plant Disease Detector,"Many families grow herbs and vegetables on rooftops or balconies. Often they can’t identify plant diseases early. A simple web portal where users upload photos of leaves, and ML models detect possible diseases (like leaf blight on curry leaf plants) and suggest remedies, would prevent crop loss.",Agriculture,"Web app, ML (image recognition)",Helps gardeners protect culturally important crops.
34,Yoga Pose Feedback Web Tool,"Beginners doing yoga at home often hold incorrect poses, risking injury. A webcam-enabled site could use ML pose detection to compare the user’s posture to the correct form for poses like Surya Namaskar, then display live feedback and corrections.",Yoga,"Web app, ML (pose estimation)",Makes yoga training accessible without costly classes.
35,Festival Crowd Density Monitor,"Little India gets very crowded during Diwali, Pongal, and Thaipusam. A web dashboard using ML-based crowd detection from CCTV or drone images can estimate density in different areas and help event organizers or shopkeepers manage foot traffic for safety.",Community,"Web app, ML (object detection)",Improves festival safety.
36,Traditional Sports Score Predictor,"Cricket, kabaddi, and goli games are common in Little India. A web platform could collect past game stats and use ML models to predict match outcomes or best-performing players, adding excitement to local tournaments.",Sports,"Web app, ML (predictive modeling)",Engages youth with traditional sports.
37,Ayurvedic Herb Finder,Many people in Little India want to find herbal remedies but don’t know which plants are which. A web-based image search where users upload plant photos and ML models identify the herb and explain its benefits could preserve traditional knowledge.,Health,"Web app, ML (image recognition)",Keeps Ayurvedic wisdom alive.
38,Emotion Detection for Senior Wellness,Elderly residents may not openly share if they’re feeling lonely or stressed. A web video chat platform could use ML facial emotion detection during casual conversations to flag when someone might need social or mental health support.,Health,"Web app, ML (emotion recognition)",Encourages proactive wellness checks.
39,AI Temple Chant Transcriber,Temple chants and bhajans are often not documented for younger generations. A web tool could take uploaded temple audio and use ML speech-to-text to transcribe and archive them for cultural preservation.,Culture,"Web app, ML (speech recognition)",Preserves oral traditions.
40,Crop Yield Estimator,"Urban farmers in Little India’s community gardens may not know how much they’ll harvest. A web platform where users input plant type, planting date, and growth photos could use ML models to predict yield, helping them plan better.",Agriculture,"Web app, ML (regression models)",Supports sustainable farming.
41,Personalized Yoga Routine Generator,"Many residents want to start yoga but don’t know where to begin. A web app could ask for details (age, health goals, flexibility level) and use ML recommendation algorithms to generate a tailored yoga plan with instructional videos.",Yoga,"Web app, ML (recommendation)",Promotes wellness through exercise planning.
42,Festival Waste Sorter,"Festivals in Little India generate a lot of mixed waste (flowers, food, plastic). A web app could let users upload waste bin photos, and ML image detection would classify waste into organic, recyclable, or general. The system could track community waste segregation performance.",Community,"Web app, ML (image classification)",Encourages eco-friendly festival practices.
43,Senior Exercise Monitor,"Many elders in Little India do gentle exercises like walking or seated yoga. A webcam-based tool could use ML pose tracking to count repetitions, monitor movement speed, and ensure exercises are done safely.",Health,"Web app, ML (pose estimation)",Helps seniors stay active safely.
44,Digital Curry Leaf Exchange,"Many homes grow curry leaves but often have extra to spare. A web marketplace could use ML demand forecasting to match surplus growers with buyers or temples needing leaves for offerings, ensuring nothing goes to waste.",Agriculture,"Web app, ML (forecasting)",Builds a sharing economy for important plants.
45,Health Risk Predictor for Street Food Lovers,Little India’s street food culture is delicious but sometimes unhealthy. A web app could let users log their weekly food choices and use ML models to predict potential health risks while suggesting healthier Indian snacks available locally.,Health,"Web app, ML (predictive analytics)",Balances food enjoyment with preventive health.
46,Community Language Learning Assistant,"Migrants in Little India sometimes struggle with English or Tamil. A web platform could use ML translation and gamified quizzes to teach them conversational skills relevant to shopping, healthcare, and daily life in the community.",Education,"Web app, ML (translation, NLP)",Improves multilingual communication.